Domain,URL,Full URL,Best For,Description/Specialty
Smashing Magazine,smashingmagazine.com,https://smashingmagazine.com,Front-End & UX Design,"Leading online magazine for professional web designers and developers, with frequent accessibility coverage."
Teach Access,https://teachaccess.org/,https://teachaccess.org/,"education, curriculum development",Resources that help educators teach accessibility concepts.
The A11Y Project,https://www.a11yproject.com/,https://www.a11yproject.com/,"best practices, checklists, onboarding","Community-driven accessibility resource with guides, checklists, and articles."
tpgi.com,https://www.tpgi.com/,https://www.tpgi.com/,"Technical Auditing, jaws, compliance, web standards","The Paciello Group (TPGi), a leading accessibility consulting and software company (Duplicate entry)."
U.S. Department of Labor - Office of Disability Employment Policy,https://www.dol.gov,https://www.dol.gov,"employment law, disability employment policy, workforce accessibility, labor regulations, workplace rights guidance","The U.S. Department of Labor site providing employment regulations, workplace rights information, and disability employment policy resources."
UK Gov Accessibility Blog,https://accessibility.blog.gov.uk/,https://accessibility.blog.gov.uk/,"policy, implementation","Government service patterns, testing insights, and accessibility processes."
US Access Board,https://www.access-board.gov/,https://www.access-board.gov/,"508 compliance, physical + digital standards",Government accessibility standards body.
Vision Australia,visionaustralia.org,https://visionaustralia.org,general accessibility,"Australian blindness and low vision service provider, offering advocacy and accessible technology services."
Vox Product Accessibility Guidelines,https://accessibility.voxmedia.com,https://accessibility.voxmedia.com,"digital accessibility standards, accessible publishing, accessible design systems, industry accessibility practices, inclusive engineering","Vox Media's accessibility portal documenting inclusive design standards, engineering patterns, and digital accessibility processes."
W3C Silver Project (WCAG 3),https://www.w3.org/WAI/GL/task-forces/silver/,https://www.w3.org/WAI/GL/task-forces/silver/,next‑gen standards,Future WCAG 3 accessibility guidelines development.
W3C Web Accessibility Initiative (WAI),w3.org/WAI/,https://w3.org/WAI/,Web Standards & Guidelines,The official World Wide Web Consortium group that develops WCAG and other accessibility guidelines.
WAI-ARIA Authoring Practices,https://www.w3.org/WAI/ARIA/apg/,https://www.w3.org/WAI/ARIA/apg/,ARIA patterns and roles,"Authoring patterns, roles, states, properties, and component guidance."
WAI-Tools Project,https://www.w3.org/WAI/Tools/,https://www.w3.org/WAI/Tools/,testing tools,EU-backed accessibility testing innovation.
WCAG Guidelines,https://www.w3.org/WAI/standards-guidelines/wcag/,https://www.w3.org/WAI/standards-guidelines/wcag/,"WCAG lookups, criteria explanations",Official Web Content Accessibility Guidelines.
Web Axe,webaxe.org,https://webaxe.org,"news, thought leadership","Podcast and blog covering digital accessibility topics, news, and tools."
WebAIM,webaim.org,https://webaim.org,Training & Evaluation,"Non-profit offering accessibility tools, training, and the annual screen reader survey."